position;company;location;posted_date;no_applicants;date_collected;type_workplace;required_skills;competitive_advantages;level;worktype;description;link_application;link_linkedin;company_name;company_size;company_sector
Analista Pl. Gente Cultura (People Analytics);{'name': 'RD', 'size': '+ de 10.001 funcionários', 'sector': 'Varejo'};São Paulo, São Paulo, Brasil;2023-06-05 14:50:20.490441;42 candidaturas;2023-06-05 15:24:20.502846;Híbrido;['Programação (computação)', 'Administração de empresas', 'Alteryx', 'Contabilidade', 'Economia', 'Gestão de pessoas', 'Inteligência de negócios (BI)', 'Promoção da inclusão', 'Resolução de problemas', 'Systematization'];;Pleno-sênior;Tempo integral;"Sobre a vaga
O grupo RD – Gente, Saúde e Bem-estar é uma empresa líder no mercado brasileiro de farmácias. Com as nossas marcas Droga Raia e Drogasil, temos mais de 2.700 unidades espalhadas por todo o país e mais de 50 mil funcionários(as) empenhados(as) em cuidar de perto da saúde e bem-estar das pessoas em todos os momentos da vida.

Até 2030, queremos ser o grupo que mais contribui para uma sociedade mais saudável. Para isso, entendemos que o nosso compromisso vai além do cuidado com a saúde individual. É preciso cuidar das pessoas, dos negócios e do planeta. Vamos juntos nessa?

O que estamos buscando?

Um (a) profissional para atuar no nosso time de People Analytics. Se você se identifica com esse desafio, essa vaga é para você!

Quais as principais responsabilidades?

Atuar no desenvolvimento de aplicações em dashboards voltados para resolução de problemas de negócios relacionados ao time de Gente e Cultura. Irá produzir visualizações relacionadas a gestão de carreira, jornada do colaborador e gestão financeira, capazes de gerar impacto na gestão de pessoas da RD.
Atuará em todo o pipeline de dados, envolvendo desde as etapas iniciais de processos de ETL até a construção de interfaces para o usuário em Power BI.
Criar soluções de automação voltadas para a sistematização de informações de processos atualmente manuais.

O que precisa ter?

Conhecimento em Power BI;
Experiência com ferramentas de desenvolvimento Low Code / No Code (Power Automate)
Experiência com ferramentas de ETL (Alteryx)

Requisitos:
Mínimo 1 ano, atuando na área;
Bacharel em Administração de empresas, Engenharia, Economia, Contabilidade ou áreas afins;

Diferencial: Conhecimento em qualquer experiência com programação.

O que oferecemos?
Horário flexível, modelo de trabalho híbrido, assistência médica, assistência odontológica, vale-transporte, fretado, seguro de vida, Einstein Conecta (telemedicina), restaurante no local, cesta de Natal, Gympass, Programa de Participação nos Resultados, benefício farmácia e Clube de Benefícios RD.

Local de trabalho: Butantã/SP.

Diversidade & Inclusão
Na RD, assumimos o compromisso de incluir e empoderar nossos(as) funcionários(as) por meio da promoção da diversidade e da inclusão. Valorizamos as pessoas, construindo uma cultura acolhedora e de respeito a todos e todas. Seja quem você é aqui!

#vemserRD";https://www.linkedin.com/jobs/view/3627809314/?alternateChannel=search&refId=dzsMBIOIUH442LkFGWejEQ%3D%3D&trackingId=tX0CIC4vgSd0u6o2daLulA%3D%3D&trk=d_flagship3_search_srp_jobs;https://www.linkedin.com/jobs/view/3627809314/?alternateChannel=search&refId=dzsMBIOIUH442LkFGWejEQ%3D%3D&trackingId=tX0CIC4vgSd0u6o2daLulA%3D%3D&trk=d_flagship3_search_srp_jobs;RD;+ de 10.001 funcionários;Varejo
Data Collector;{'name': 'Appen', 'size': '501-1.000 funcionários', 'sector': 'Serviços e consultoria de TI'};Rio de Janeiro, Rio de Janeiro, Brasil;2023-05-15 15:24:23.099652;;2023-06-05 15:24:23.104649;Remoto;['Banco de dados', 'Anotações', 'Análise sentimental', 'Coleta de dados', 'Confidencialidade', 'Habilidades analíticas', 'Mecanismos de pesquisa', 'Microsoft Windows', 'Windows 7', 'Windows Vista'];;Assistente;Meio período;"Sobre a vaga
Looking for a great way to earn extra cash while you are at home? Help improve AI technology through data collection.


What exactly is Data Collection Job?
As a data collector, you enter information into a database and ensure that your data collection sources are accurate. Data collection is the process of gathering and measuring information on variables of interest, in an established systematic fashion that enables one to answer stated research questions and evaluate outcomes.


The goal of this project is to tap into the collective intelligence of the public at large. This project allows researchers to collect large amounts of interesting data points from a wide variety of individuals and allows people who like annotation work the opportunity to participate in a variety of tasks. The results of tasks will be used in a wide variety of applications - data annotation, multimedia, sentiment analysis, and search engine result evaluation.


No experience is necessary, all you need is:
Eligible to work in the country you are currently located in and resided in for the past 5 years
Must be flexible to learn new sets of standards and can work independently
Have experience in using web browsers to navigate and evaluate different types of content
Have access to a Computer OS, which should be Microsoft Vista, Microsoft Windows 7, and above


Don’t miss the chance to earn extra income working from the comfort of your own home. This is a great opportunity for you and your friends!
• Work from home with flexible hours
• You can work on our projects around your other jobs

Thank you and we hope to work with you soon!

""Appen has a diverse, inclusive culture that is vital to our mission of helping build better AI. We offer opportunities for individuals of all abilities and backgrounds.""";https://connect.appen.com/qrp/public/project?type=data_collection&utm_source=LinkedIn%20Premium&utm_medium=Job%20Post&utm_campaign=ST_Lsilla_DC__LinkedIn%20Premium_2022&utm_content=;https://www.linkedin.com/jobs/view/3599997115/?alternateChannel=search&refId=dzsMBIOIUH442LkFGWejEQ%3D%3D&trackingId=rg%2FusIToq4NdGg7JFJRCfw%3D%3D&trk=d_flagship3_search_srp_jobs;Appen;501-1.000 funcionários;Serviços e consultoria de TI
Analista de Data Science Sr.;{'name': 'Banco ABC Brasil', 'size': '1.001-5.000 funcionários', 'sector': 'Bancos'};São Paulo, São Paulo, Brasil;2023-05-31 15:24:49.177976;46 candidaturas;2023-06-05 15:24:49.190816;Presencial;['Analítica', 'Analítica de dados', 'Capacidade analítica', 'Ciência de dados', 'Dashboards', 'Desenvolvimento de relatório', 'Geração de insights', 'Gestão de dados', 'Insights de negócios', 'Resolução de problemas'];;Pleno-sênior;Tempo integral;"Sobre a vaga
Job Description

Já pensou como Data Science pode impactar o setor financeiro? É assim que o Banco ABC, que tem mais de 30 anos de experiência no segmento de empresas, tem atraído profissionais das áreas de dados e tecnologia para participar do processo de transformação digital da companhia, oferecendo produtos e serviços financeiros diferenciados para o Middle Market brasileiro. Como analista de inteligência de negócio da área de Customer Intelligence, você será responsável por aplicar o que há de mais inovador em data science para gerar insights sobre os nossos clientes, utilizando dados, metodologia ágil e tecnologia de ponta para contribuir com a missão do banco.

Responsibilities and assignments

Buscamos pessoas talentosas e com experiência em Data Analytics para o nosso time de Customer Intelligence, que será responsável pelo desenvolvimento de relatórios e visões analíticas para as áreas de negócio do Banco ABC.

Principais Responsabilidades e Atribuições

Habilidades de interpretação e resolução de problemas de negócio com dados;
Habilidade de comunicação para interação com stakeholders;
Desenvolvimento de dashboards para geração de KPI´s utilizando ferramentas de BI;
Capacidade analítica para geração de insights e elaboração de storytelling;
Criação, manutenção e gestão de dados nas plataformas analíticas.

Requirements And Qualifications

Principais requisitos e qualificações:

Formação nas áreas de exatas (engenharias, estatística, matemática, física, computação ou economia);
Conhecimentos avançados de SQL;
Conhecimentos avançados de ferramentas de BI (Tableau e Looker);
Inglês avançado para leitura;
Experiência em Cloud Computing (GCP);
Habilidade de implantação e automatização de ETL e dashboards.

Quem somos

Somos um banco múltiplo, especializado na concessão de crédito e serviços para empresas de médio e grande porte, sendo um dos únicos no país com suporte de um controlador internacional combinado a uma forte autonomia de gestão local.

Com amplo portfólio de produtos, há mais de 30 anos auxiliamos os clientes a encontrar as melhores soluções para os seus negócios.

Listado desde 2007 no Nível 2 de governança corporativa da B3, recentemente expandimos nossa atuação também para as áreas de Comercialização de Energia e Corretagem de Seguros.

Temos como foco a nossa evolução contínua. Para isso, valorizamos profissionais que desejam ser protagonistas de suas carreiras.

Buscamos oferecer aos nossos colaboradores um ambiente cheio de oportunidades de desenvolvimento, onde prezamos por relações colaborativas e abertura para falar e ser ouvido.

Junte-se a nós e tenha a chance de colaborar com ideias e ações para descobrir maneiras únicas de ultrapassar os limites do mercado.";https://abcbrasil.gupy.io/job/eyJzb3VyY2UiOiJndXB5X3B1YmxpY19wYWdlIiwiam9iSWQiOjQ2NDIyODZ9?jobBoardSource=gupy_public_page;https://www.linkedin.com/jobs/view/3623369267/?alternateChannel=search&refId=dzsMBIOIUH442LkFGWejEQ%3D%3D&trackingId=U7ALllU7zfqmaLYGaYpagA%3D%3D&trk=d_flagship3_search_srp_jobs;Banco ABC Brasil;1.001-5.000 funcionários;Bancos
Analista de Business Intelligence / BI;{'name': 'Frescatto Company', 'size': '501-1.000 funcionários', 'sector': 'Serviços de alimentos e bebidas'};Duque de Caxias, Rio de Janeiro, Brasil;2023-05-22 15:24:57.156414;;2023-06-05 15:24:57.161415;Presencial;['Microsoft Excel', 'Python', 'Análise técnica', 'Benefícios de funcionários', 'Desenvolvimento de relatório', 'Economia', 'Google Data Studio', 'Habilidades analíticas', 'Inteligência de negócios (BI)', 'Relatório'];;;Tempo integral;"Sobre a vaga
Requisitos Necessários:
• Superior completo em Administração, Economia, Ciências Contábeis, Engenharias e/ou áreas afins;
• Experiência comprovada na área de BI;
• Vivência com a ferramenta Tableau ou similar (IBM Cognos, Zoho Analytics, Power BI Microsoft, Qlikview, Google Data Studio, Project BI, etc.);
• Visão voltada para área de negócios, análises comercial;
• Experiência na formação de indicadores de resultados - KPI;
• Conhecimento de Excel Avançado.
• Conhecimento no ERP Sapiens será um diferencial.

Desejável para o perfil:
• Conhecimento sobre tecnologias de ETL;
• Conhecimentos em SQL (Banco Oracle e SQL Server);
• Experiência no Desenvolvimento de Relatórios para o ERP Sapiens;
• Desejável conhecimento dos bancos NEO4J e MONGO DB;
• Desejável conhecimento nas linguagens Python e R.

Principais atividades:

• Levantar as Situações/Problemas e promover soluções/melhorias;
• Fazer a análise técnica de requisitos;
• Apoiar na definição da arquitetura, a partir dos requisitos e necessidades dos usuários na plataforma de BI;
• Desenvolver Visões/Dashboards de acordo com as definições solicitadas;
• Documentar as funcionalidades e evolução das visões/programas desenvolvidos;
• Automatizar as validações dos dados das visões;
• Atuar com excelência na construção de indicadores e informações para tomada de decisão.
• Dar suporte aos usuários nos resultados apurados e nos modelos de resultados customizados de cada área.

SALÁRIO: Informar pretensão salarial + benefícios: Assistência Médica (após 3 meses), Assistência Odontológica, Alimentação no local (Café da manhã, almoço e lanche), Vale Transporte ou Ticket Combustível, Seguro de vida, Consignado, Incentivo Estudantil, Desconto em Produtos, Clube de Vantagens, Convênios diversos, Day off

Horário: 2ºfeira a 6ºfeira - 8h12 as 18h

Local: Duque de Caxias / RJ - Atrás do Shopping Outlet Premium";https://www.linkedin.com/jobs/view/3605131159/?alternateChannel=search&refId=dzsMBIOIUH442LkFGWejEQ%3D%3D&trackingId=bUSGcUKdTve%2FvdwUjas8tw%3D%3D&trk=d_flagship3_search_srp_jobs;https://www.linkedin.com/jobs/view/3605131159/?alternateChannel=search&refId=dzsMBIOIUH442LkFGWejEQ%3D%3D&trackingId=bUSGcUKdTve%2FvdwUjas8tw%3D%3D&trk=d_flagship3_search_srp_jobs;Frescatto Company;501-1.000 funcionários;Serviços de alimentos e bebidas
Market Insights Analyst;{'name': 'GfK', 'size': '5.001-10.000 funcionários', 'sector': 'Serviços e consultoria de TI'};São Paulo, São Paulo, Brasil;2023-06-01 15:24:59.709792;58 candidaturas;2023-06-05 15:24:59.720666;;['Comunicação', 'Analítica', 'CSM', 'Cherwell Service Management (CSM)', 'Controle de qualidade', 'Habilidades analíticas', 'Habilidades de apresentação', 'Inglês', 'Visualização de dados'];;Assistente;Tempo integral;"Sobre a vaga
Country

Brazil

Job Family

Customer Success Management

For almost 90 years, GfK has been a reliable and trusted insight partner for the world’s biggest companies and leading brands who make a difference in every consumer’s life - and we will continue to build on this. We connect data, science and innovative digital research solutions to provide answers for key business questions around consumers, markets, ROI, brands and media. With our headquarters in Germany and a presence in around 60 countries worldwide, you benefit from our global company with a diverse community of 8,000+ employees.

Harnessing the power of our workforce, the greatest asset we have is our people. As part of GfK, you can take your future into your own hands. We value talent, skills and responsibility and will support your development within our international teams. We are proud of our heritage and our future, as we continue our evolution from Market Research provider to SaaS data solutions and consulting partner. We value extraordinary people and this is why we are looking for YOU to help create our future. For our employees as well as for our clients we pursue one goal: Growth from Knowledge!

Job Description

As a CSM Specialist you will have the following key accountabilities:
Be a point of support for clients clients in the durables sector supported by your manager and acting as the main point of contact for these clients.
Provide relevant insights that enable smarter business decisions and drive growth for our partners.
Assist to ensure data quality and regular report delivery, complying with the agreed standard for each client. You should also propose and execute improvements in existing processes and client reports.
Offer support and guide clients to adequately use GfK information. You will also hold training sessions for new users and present GfK’s research results on clients.
Eventually, support on new clients prospection.
Work cross functionally within the business to ensure client needs are met and questions answered.
Now that we have introduced you to the position as CSM Specialist, what skills, qualifications and experience should you, have?
A Bachelor’s degree
Strong analytical skills
Good communication skills
Ability to maintain client relationships
Client focus, eye for detail and high quality standards
Advanced level MS Office (Excel and Powerpoint)
Advanced English
We are an ethical and honest company that is wholly committed to its clients and employees. We are proud to be an inclusive workplace for all and are committed to equal employment opportunity, focusing on all of our employees reaching their full potential.

We respect and value every employee regardless of race, ethnicity, gender, sex, sexual orientation, age, personality, experience, culture, faith, socio-economic status, or physical or mental disabilities.

We endorse the core principles and rights set forth in the United Nations Declaration of Human Rights and the Social Charter of Fundamental Rights of the European Union, promoting the universal values of human dignity, freedom, equality, and solidarity.

Learn more about how we are driving diversity and inclusion in everything we do on: https://www.gfk.com/about-gfk/diversity-and-inclusion

At GfK we work collaboratively with our colleagues but offer a flexible working approach, including dividing our time between office & remote working as well as the opportunity to flex our working hours around team core hours.

We offer an exciting work environment that brings people together. We encourage an entrepreneurial and innovative spirit and make use of the latest digital technologies. We are looking for self-starters, who accept challenges and create solutions.

Can there be a better place to take center stage in the digital revolution? We are excited to get to know you!";https://gfk.wd3.myworkdayjobs.com/Corporate_Careers/job/Sao-Paulo/Market-Insights-Analyst_R00019438;https://www.linkedin.com/jobs/view/3618938037/?alternateChannel=search&refId=dzsMBIOIUH442LkFGWejEQ%3D%3D&trackingId=kFo2yAez7l5nwYJmmZLhLg%3D%3D&trk=d_flagship3_search_srp_jobs;GfK;5.001-10.000 funcionários;Serviços e consultoria de TI
Senior Data Analyst - Remote - Latin America;{'name': 'FullStack Labs', 'size': '501-1.000 funcionários', 'sector': 'Serviços e consultoria de TI'};Curitiba, Paraná, Brasil;2023-05-31 15:25:19.307273;15 candidaturas;2023-06-05 15:25:19.320794;Remoto;['Análise de dados', 'Analítica', 'Analítica de dados', 'Atenção a detalhes', 'Ciência de dados', 'ETL (Extração, transformação e carregamento)', 'Looker (Software)', 'Mineração de dados', 'Visualização', 'Visualização de dados'];;Pleno-sênior;Tempo integral;"Sobre a vaga
FullStack is the fastest-growing software consultancy in the Americas. We help organizations like Uber, GoDaddy, MGM, Siemens, Stanford University, and the State of California, build distributed software development teams, and deliver transformational digital solutions. As an employee-first company, we focus on hiring the most talented software designers and developers in the western hemisphere, by creating a positive, respectful, and supportive work environment where they can achieve their greatest potential.

We’re most proud of:
Offering life-changing career opportunities to talented software professionals across the Americas.
Building highly-skilled software development teams for hundreds of the world’s greatest companies.
Having delivered hundreds of successful custom software solutions, which have positively impacted the lives and careers of millions of users.
Our 4.5-star rating on GlassDoor.
Our client Net Promoter Score of 68, twice the industry average.

The Position:

We're looking to hire one Data Analysts to join our team. You'll work with our incredible clients in one of two ways:
Team Augmentation: You will integrate yourself directly into our client's team and work alongside their existing designers and engineers on a daily basis.
Design & Build: You will work on a FullStack Labs product team to build and deliver a product to our clients.

What We're Looking For:
As a Data Engineer, you'll be working in a team responsible for Reports and Analytics for the highly loaded system and helping the team to achieve extraordinary results to impact the product and deliver the best solution to the market.
5+ years of experience in Data Analysis.
Meaningful experience with data visualization and ETL.
Strong SQL experience is a must.
Experience leading teams.
Experience with Looker and Tableau tools.
Advanced English is required.
A four-year college degree is required.
Ability to take extreme ownership over your work. Every day is a challenge to ensure you are performing to the expectations you and your team have agreed upon.
Ability to identify with the goals of FullStack's clients, and dedicate yourself to delivering on the commitments you and your team make to them.
An understanding of best practices and a commitment to following them.
Ability to work through new and difficult issues and contribute to libraries as needed.
A positive mindset and can-do attitude.
Forensic attention to detail.

Benefits:
Competitive pay in your local currency.
100% remote work.
The ability to work with leading startups and Fortune 500 companies.
English Classes.
Virtual company events each month.
Ample opportunity for career advancement.
Continuing education opportunities.
Depending on your location other benefits may apply.

FullStack is proud to be an equal opportunity workplace. We are committed to equal employment opportunity regardless of race, color, ancestry, religion, sex, national origin, sexual orientation, age, citizenship, marital status, disability, gender identity, or Veteran status. If you have a disability or special need that requires accommodation, please let us know by completing our Accommodations for Applicants form, which can be provided upon request during our hiring and interview process.

Learn more about our Applicants Privacy Notice .";https://jobs.lever.co/fullstacklabs/bc698f87-36c3-4b7c-aa25-b943707fcfbc?source=6;https://www.linkedin.com/jobs/view/3623532597/?alternateChannel=search&refId=dzsMBIOIUH442LkFGWejEQ%3D%3D&trackingId=Ik2LdbJM7huKNfiCqSSVYA%3D%3D&trk=d_flagship3_search_srp_jobs;FullStack Labs;501-1.000 funcionários;Serviços e consultoria de TI
Sports Statistician;{'name': 'Genius Sports', 'size': '1.001-5.000 funcionários', 'sector': 'Desenvolvimento de software'};São José dos Campos, São Paulo, Brasil;2023-05-15 15:25:42.290023;162 candidaturas;2023-06-05 15:25:42.302172;Presencial;['Esportes', 'Futebol americano', 'Internet Access', 'Setor de esportes', 'Skype', 'Treinamento', 'Táticas', 'Voleibol', 'YouTube'];;Assistente;Contrato;"Sobre a vaga
Love sports?

We're looking for someone like you.

Job type - Contract based (Not part-time or full-time)

Get to know us - https://geniussports.com/statisticians-network/

This is an opportunity for exciting and fast-paced work as a Sports Statistician.

If you enjoy sports and would like to become a part of the sports industry, this could be your chance! You will get thorough training in using the company software which is used for entering the data in order to provide the best analyses of the game possible.

Requirements:
You are reliable, committed, organized, and honest.
Above-average Football and Volleyball knowledge with regard to the Laws of the Game, basic tactics, and jargon
Regular availability on weekends and weekday evenings
Regular internet access
Access to Skype and YouTube for meetings and training tools

Interested and want to learn more?
Tell us a bit about yourself and we'll be in touch with you for more information about becoming sports a statistician. You must be 18 or older to apply.";https://boards.greenhouse.io/geniussports/jobs/4180598003?gh_jid=4180598003&gh_src=0d02f23f3us&s=LinkedIn&source=LinkedIn;https://www.linkedin.com/jobs/view/3605574512/?alternateChannel=search&refId=dzsMBIOIUH442LkFGWejEQ%3D%3D&trackingId=24gGiLYk%2B7JygaMTa5lECw%3D%3D&trk=d_flagship3_search_srp_jobs;Genius Sports;1.001-5.000 funcionários;Desenvolvimento de software
Senior Power BI Consultant;{'name': 'Keyrus', 'size': '1.001-5.000 funcionários', 'sector': 'Tecnologia da informação e serviços'};São Paulo, São Paulo, Brasil;2023-05-22 15:26:00.052069;200 candidaturas;2023-06-05 15:26:00.069794;;['Banco de dados', 'SQL', 'Dashboards', 'Data warehouse', 'ETL (Extração, transformação e carregamento)', 'Inteligência de negócios (BI)', 'Microsoft Power BI', 'Modelagem de dados', 'Negociação', 'SAP BusinessObjects'];;Pleno-sênior;Tempo integral;"Sobre a vaga
A Keyrus acredita na diversidade e na inclusão. Encorajamos a todos a participarem em nosso processo de contratação, não importando o gênero, idade, raça, religião. Não permitimos nenhum tipo de discriminação. Isto é reforçado no processo de contratação e vivido dessa forma na empresa.

Sabemos que grandes resultados só são alcançados com uma grande equipe, por isso procuramos pessoas talentosas e apaixonadas, com desejo de crescer profissionalmente e criar uma trajetória de carreira conosco.

Papéis e Responsabilidades

Será responsável pela administração, desenvolvimento, suporte, manutenção e implementação de ambiente Microsoft PBI.

Deve ter boa experiência na aplicação de melhores práticas de desenvolvimento.

Ser capaz de trabalhar como um membro de equipe independente, capaz de aplicar julgamentos para planejar e executar suas tarefas. Ser capaz de responder a consultas / solicitações técnicas de membros da equipe e clientes e capaz de treinar, orientar os membros juniores da equipe.

Qualificações Essenciais

Conhecimento em Power BI e SQL.

Experiência em realizar análise do negócio, desenvolvimento de relatórios e integração de dados.

Nossa missão é Auxiliar as empresas a extrair todo o potencial de Dados e Digital objetivando aumentar seu desempenho, ajudando na transformação, gerando novas alavancas de crescimento e competitividade.

Vem fazer parte do Time Keyrus!

Se você quiser saber mais sobre nós, convidamos você a visitar nosso site: http://www.keyrus.com/br/

Desejamos boa sorte! 😊🚀";https://jobs.keyrus.com.br/jobs/2842669-senior-power-bi-consultant;https://www.linkedin.com/jobs/view/3606197515/?alternateChannel=search&refId=dzsMBIOIUH442LkFGWejEQ%3D%3D&trackingId=WR3cnuuJifN4NW4tpLTI0A%3D%3D&trk=d_flagship3_search_srp_jobs;Keyrus;1.001-5.000 funcionários;Tecnologia da informação e serviços
