position;company;location;posted_date;no_applicants;date_collected;type_workplace;required_skills;competitive_advantages;level;worktype;description;link_application;link_linkedin;company_name;company_size;company_sector
Analista de Gestão de Dados;{'name': 'Moove', 'size': '1.001-5.000 funcionários', 'sector': nan};São Paulo, São Paulo, Brasil;2023-06-02 15:06:50.791991;;2023-06-05 15:06:50.800990;Híbrido;['SQL', 'Alteryx', 'Azure Data Factory', 'Azure Data Lake', 'Data warehouse', 'ETL (Extração, transformação e carregamento)', 'Produtos SAP', 'SAP ERP', 'SSIS', 'Windows Azure'];;;Tempo integral;"Sobre a vaga
Posição: Analista de Gestão de Dados
Área: TI
Local de Trabalho: São Paulo (Híbrido)

Desafio:
A Moove está buscando um Analista de Gestão de Dados para a área de Tecnologia que participará ativamente nas demandas e projetos se comunicando com todas as áreas de negócios. Utilizará as ferramentas disponíveis para extração, transformação e disponibilização dos dados para todas as unidades de negócios e participará na definição de novas ferramentas conforme as necessidades de dados e/ou negócios.

Principais Responsabilidades:

- Participar na definição e implementação de melhores práticas de arquitetura e modelagem de dados;
- Desenvolver, aprimorar e suportar fluxos de trabalho e processos de transformação de dados, incluindo preparação e orquestração de dados em larga escala e integração via API;
- Definir tarefas de desenvolvimento detalhadas, dependências de tarefas e estimativas para concluir o trabalho;
- Identificar proativamente problemas, além de apresentar e se necessário desenvolver soluções;
- Trabalhar com parceiros de negócios para priorizar as necessidades de negócios e informações;
- Comunicar-se efetivamente com as partes interessadas internas e a gestão.

Qualificações:
- Experiência de trabalho em ambientes SQL Server, SSIS, Azure Data Lake Storage Gen 2;
- Experiência trabalhando com ferramentas ETL como Alteryx, Azure Data Factory, Theobald;
- Conhecimento em Data Warehouse como conceitos, práticas e procedimentos;
- Conhecimento de ferramentas como SAP ECC e salesforce;
- Ensino Superior em Tecnologia da Informação
- Inglês Avançado

Benefícios

Participação nos lucros
Vale-refeição/ Refeitório
Programa de Apoio ao Funcionário
Assistência médica e odontológica
Auxílio farmácia
Seguro de vida
Previdência privada
Gympass
Auxílio Óptico
ATS
Vale Transporte/ Estacionamento";https://www.linkedin.com/jobs/view/3624224677/?alternateChannel=search&refId=tCWVCdLmkJlTrZ5vCMuj9w%3D%3D&trackingId=riP9DcjjA6I7Vswe6da0Iw%3D%3D&trk=d_flagship3_search_srp_jobs;https://www.linkedin.com/jobs/view/3624224677/?alternateChannel=search&refId=tCWVCdLmkJlTrZ5vCMuj9w%3D%3D&trackingId=riP9DcjjA6I7Vswe6da0Iw%3D%3D&trk=d_flagship3_search_srp_jobs;Moove;1.001-5.000 funcionários;
Marketing Data Analyst;{'name': 'Valtech', 'size': '5.001-10.000 funcionários', 'sector': 'Serviços e consultoria de TI'};São Paulo e Região;2023-05-29 15:06:57.048773;77 candidaturas;2023-06-05 15:06:57.059778;;['Analítica', 'Analítica de dados', 'Análise de marketing', 'Dashboards', 'Gerenciador de tags do Google', 'Habilidades analíticas', 'Hotjar', 'Indicadores-chave de desempenho', 'Otimização para mecanismos de busca (SEO)', 'Web Analytics'];;Pleno-sênior;Tempo integral;"Sobre a vaga
A Valtech é uma Agência Digital global que possui escritórios em 22 países. Nós projetamos e construímos experiências únicas, executamos esforços de melhoria contínua e vivemos, alimentamos e impulsionamos a transformação dos negócios em todo o mundo digital. Apoiamos nossos clientes na pesquisa, design e marketing de experiências e interfaces digitais inteligentes.

Estamos em busca de um Analista de Dados de Marketing Digital com experiência em análise, métricas, otimização, SEO e uma paixão por resolver desafios do cliente por meio de dados e gerar retorno à seus investimentos digitais e conjuntos de produtos. O candidato ideal terá experiência prática com várias plataformas, como Google Analytics, Google Tag Manager, Salesforce Commerce Cloud, Optimizely e outras. Você poderá trabalhar em nossos escritórios de São Paulo, Florianópolis ou remotamente.

Suas atividades serão:
Realizar workshops para definir KPIs, metas digitais, requisitos de projeto e apoiar os clientes sobre as melhores práticas digitais.
Implementar e gerenciar o Google Tag Manager e o Google Analytics 4 em sites, incluindo implementação, manutenção, controle de qualidade, análise de dados do GA4 e realizar migrações do Universal Analytics para o GA4.
Desenvolver e executar planos de otimização, experimentos e estratégias de dados, incluindo design de camada de dados, planos de tags e planos de automação de marketing.
Criar e implemente dashboards, relatórios contínuos, recomendações e melhorias.
Atuar como um consultor de confiança para os clientes, fornecendo orientação geral e experiência.
Contribuir para a liderança de pensamento e apoiar os esforços de vendas, definindo oportunidades iniciais.

Requisitos que você precisa atender:
Graduação em Marketing, Estatística, Ciência da Computação, Economia ou áreas afins.
Experiência em análise de marketing digital, preferencialmente em uma agência ou ambiente de negócios.
Experiência com ferramentas analíticas como Google Tag Manager, Google Analytics, Adobe Analytics.
Compreensão da estratégia de marketing e táticas de otimização, incluindo personalização, SEO, teste A|B, automação, segmentação de público e direcionamento de conteúdo.
Experiência em apresentações para stakeholders e na condução de workshops e ações de treinamento.
Conhecimento de ferramentas populares de marketing digital e estratégias de canal na web, e-mail, mídia social e dispositivos móveis.
Experiência no desenvolvimento e implementação de estratégias de medição e planos de tagueamento.
Inglês avançado para conversação.

Consideraremos um diferencial se você tiver:
Familiaridade com DXPs como Sitecore, Optimizely, Salesforce Commerce Cloud.
Experiência em ambiente de consultoria ou atendimento ao cliente (>2 anos).
Experiência com ferramentas de dashboard como Looker Studio, PowerBI, Tableau.
Conhecimento de ferramentas de SEO/otimização como Semrush, CrazyEgg, HotJar.
Experiência com plataformas de dados de cliente (CDP).

Por que trabalhar conosco?
Cultura: Oferecemos cultura de aprendizado contínuo, valorização pessoal e profissional, cuidado com a qualidade de vida e saúde mental dos colaboradores, ambiente de diversidade e inclusão, oportunidades de interação cultural. Ambiente de colaboração e compartilhamento de conhecimento, propício à inovação e criatividade constante.
Benefícios: Temos também benefícios abrangentes como plano de saúde e odontológico, Cartão flexível para demandas de alimentação, cultura, educação, mobilidade, etc., programa de idiomas, Gympass e outros. Temos ainda ambiente descontraído, horário de trabalho flexível e intenso investimento na carreira.
D&I: Na valtech, criamos experiências que funcionem e alcancem todas as pessoas. Nosso objetivo é criar um ambiente de trabalho justo que dê às pessoas o apoio de que precisam para prosperar, crescer e atingir seus objetivos. Para isso, construímos todos os dias um ambiente inclusivo e diverso em relação à deficiências, idade, identidade de gênero e orientação sexual, etnia e raça, religião, culturas e experiências, oferecendo oportunidades equitativas para todos construírem sua carreira em uma empresa que só cresce. Portanto, nossas vagas são para TODAS as pessoas! Você pode descobrir mais sobre o que estamos fazendo para criar uma Valtech para todos aqui.";https://careers.brazil.valtech.com/jobs/2727912-marketing-data-analyst;https://www.linkedin.com/jobs/view/3613520213/?alternateChannel=search&refId=tCWVCdLmkJlTrZ5vCMuj9w%3D%3D&trackingId=fdTnCgftVOU3WAZKu2gUWw%3D%3D&trk=d_flagship3_search_srp_jobs;Valtech;5.001-10.000 funcionários;Serviços e consultoria de TI
Football Statistician;{'name': 'Genius Sports', 'size': '1.001-5.000 funcionários', 'sector': 'Desenvolvimento de software'};Crateús, Ceará, Brasil;2023-05-29 15:07:01.909347;47 candidaturas;2023-06-05 15:07:01.919349;Presencial;['Esportes', 'Futebol americano', 'Inglês', 'Internet Access', 'Setor de esportes', 'Skype', 'Treinamento', 'Táticas', 'YouTube'];;Assistente;Contrato;"Sobre a vaga
Love sports?

We're looking for someone like you!

Job type - Contract based (Not part-time or full-time)

Get to know us - https://geniussports.com/statisticians-network/

This is an opportunity for exciting and fast-paced work as a Football Statistician.

If you enjoy sports and would like to become a part of the sports industry, this could be your chance! You will get thorough training in using the company software which is used for entering the data to provide the best analyses of the game possible.

Requirements:
You are reliable, committed, organized, and honest
Above-average Football knowledge with regard to the Laws of the Game, basic tactics, and jargon
Regular availability on weekends and weekday evenings
Regular internet access
Access to Skype and YouTube for meetings and training tools

Interested and want to learn more?
Tell us a bit about yourself and we'll be in touch with you for more information.";https://boards.greenhouse.io/geniussports/jobs/4180598003?gh_jid=4180598003&gh_src=0d02f23f3us&source=LinkedIn;https://www.linkedin.com/jobs/view/3580156456/?alternateChannel=search&refId=tCWVCdLmkJlTrZ5vCMuj9w%3D%3D&trackingId=2zbEExBdTCJib19l2eKsuQ%3D%3D&trk=d_flagship3_search_srp_jobs;Genius Sports;1.001-5.000 funcionários;Desenvolvimento de software
­­­Analista Privacidade de Dados Sr – Prazo Determinado (6 meses);{'name': 'CPFL Energia', 'size': '5.001-10.000 funcionários', 'sector': 'Serviços de eletricidade, gás, água e esgoto'};Campinas, São Paulo, Brasil;2023-05-29 15:07:15.555500;98 candidaturas;2023-06-05 15:07:15.567136;Presencial;['Análise de dados', 'Microsoft Excel', 'Avaliação de riscos', 'Conformidade regulatória', 'Contabilidade', 'Documentação', 'Habilidades analíticas', 'Inglês', 'Inteligência de negócios (BI)', 'Microsoft Office'];;;Tempo integral;"Sobre a vaga
Analista Privacidade de Dados Sr – Prazo Determinado (6 meses)

A SUA ENERGIA FAZ A CPFL

Inovamos para oferecer as melhores soluções aos nossos clientes e trabalhamos de maneira colaborativa para entregar os melhores resultados e alcançar a excelência em tudo o que fazemos. Geramos valor de forma sustentável, atuando sempre com responsabilidade social, integridade, transparência e segurança. Para nós, o desenvolvimento de colaboradoras e colaboradores caminha junto com o crescimento da CPFL.

O Nosso Jeito de Ser valoriza a diversidade e respeita as diferenças, por isso praticamos ações afirmativas em que reservamos vagas para aumentar cada vez mais a representatividade de grupos sociais minorizados, como por exemplo, mulheres, pessoas com deficiência e pessoas negras. Essas ações fazem parte da nossa estratégia e compromissos para uma cultura inclusiva. Conheça mais sobre nosso posicionamento em link (https://cpfl.riweb.com.br/show.aspx?idCanal=m1DU2SlCXo7pvQ/fBEMIxg==)

Se você se identifica com os nossos valores e acredita que pode fazer a diferença para os nossos negócios, venha compartilhar a sua energia e crescer com a CPFL.

Onde você vai atuar: Campinas- SP

Empresa: Cia Piratininga Força Luz – Uma empresa do grupo CPFL Energia

Principais Atividades:

Apoiar nas atividades de mapeamento e avaliação de riscos de privacidade em Proteção de Dados Pessoais (processos, produtos e serviços) e dar suporte na avaliação do risco relevante de proteção de dados na hipótese de incidente de segurança envolvendo dados pessoais. Dar suporte na atualização dos inventários de dados da organização.
Apoiar na atualização da matriz de riscos e controles internos de Proteção de Dados Pessoais e no cumprimento do cronograma de avaliação dos controles, propondo melhorias sempre que identificadas.
Monitorar os indicadores e controles internos relacionados a Privacidade em Proteção de Dados Pessoais visando a conformidade e cumprimento do Programa de Privacidade e Proteção de Dados. Manter os indicadores de Proteção de Dados atualizados, apoiar esforços de revisão, melhorias e automação. Divulgar indicadores para o público adequado conforme calendário da área.
Manter políticas e normas atualizadas sob orientação da liderança.
Apoiar e conduzir follow up dos riscos de privacidade identificadas junto as áreas de negócio

O que buscamos:

Ensino Superior Completo (Administração, Economica, Contabilidade e afins)
Experiência na avaliação de riscos de privacidade de dados, controles internos e Compliance
Habilidade com análise da dados, definição de métricas e indicadores
Habilidades com excel pacote office
Necessário Inglês Intermediário (criação e interpretação de documentos)
Desejável conhecimento em Power BI - intermediário (gráficos, dashboards)
Desejável conhecimentos de LGPD
Desejável conhecimento em ferramentas de gestão de privacidade

O que oferecemos:
Vale Transporte;
Vale Refeição;
Assistência Médica;
Assistência Odontológica;
Auxílio creche (conforme regras de elegibilidade);
Seguro de Vida;
PLR;
Gympass;
Programa Fale Comigo (assessoria gratuita e sigilosa via telefone para auxílio psicológico, jurídico, financeiro, social e fonoaudiólogo).

O Grupo CPFL Energia

A CPFL Energia, há 109 anos no setor elétrico, atua nos segmentos de distribuição, geração, transmissão, comercialização e serviços. Desde janeiro de 2017, o Grupo faz parte da State Grid, estatal chinesa que é a terceira maior organização empresarial do mundo e a maior empresa de energia elétrica, atendendo 88% do território chinês e com operações na Itália, Austrália, Portugal, Filipinas e Hong Kong.

Com 14% de participação, a CPFL Energia é uma das maiores empresas no mercado de distribuição, totalizando mais de 9,9 milhões de clientes em 687 cidades, entre os estados de São Paulo, Rio Grande do Sul, Minas Gerais e Paraná.

Na comercialização, é uma das líderes no mercado livre, com participação de mercado de 4%. É líder na comercialização de energia incentivada para clientes livres entre as comercializadoras.

Na geração, é a terceira maior agente privada do País, com capacidade instalada de 4.305 MW, no final de setembro de 2020. Tem um portfólio baseado em fontes limpas e renováveis, como grandes hidrelétricas, usinas eólicas, térmicas a biomassa, Pequenas Centrais Hidrelétricas (PCH) e usina solar. A CPFL Renováveis é a maior empresa de geração da América Latina a partir de fontes alternativas de energia.

A CPFL Energia possui ações listadas no Novo Mercado da B3. O Grupo também ocupa posição de destaque em arte e cultura, entre os maiores investidores brasileiros, por meio do Instituto CPFL.";https://career19.sapsf.com/sfcareer/jobreqcareer?jobId=27821&company=cpflenergi;https://www.linkedin.com/jobs/view/3613286152/?alternateChannel=search&refId=tCWVCdLmkJlTrZ5vCMuj9w%3D%3D&trackingId=n%2BVNl7XyZmSVXYS57%2BfihQ%3D%3D&trk=d_flagship3_search_srp_jobs;CPFL Energia;5.001-10.000 funcionários;Serviços de eletricidade, gás, água e esgoto
ANALISTA CADASTRO JR;{'name': 'AkzoNobel', 'size': '+ de 10.001 funcionários', 'sector': 'Fabricação de produtos químicos'};Mauá, São Paulo, Brasil;2023-06-03 15:07:28.657900;101 candidaturas;2023-06-05 15:07:28.678311;Presencial;['Comunicação', 'Análise de negócios', 'Apresentações', 'Clientes internos', 'Comunicação interna', 'Documentação', 'Fontes tipográficas', 'Habilidades analíticas', 'Liderança de equipe', 'Relatório'];;;Tempo integral;"Sobre a vaga
Somos pioneiros em um mundo de possibilidades de dar vida a superfícies há mais de 200 anos. Como especialistas na fabricação de revestimentos, há uma boa chance de você estar a poucos metros de distância de um de nossos produtos. Nosso portfólio de marcas de classe mundial – incluindo Dulux, International, Sikkens e Interpon – tem a confiança de clientes em todo o mundo. Estamos ativos em mais de 150 países e temos como objetivo nos tornarmos líderes globais do setor. É o que se espera da empresa de tintas mais sustentáveis, que inventa o futuro há mais de dois séculos.

Job Purpose

A pessoa analista de Cadastro JR possui como objetivo administrar nossos dados dentro do nosso sistema, assim como dados de nossos clientes e fornecedores da região dos EUA e México. Tomando cuidado para sempre respeitar as diretrizes internas da empresa e responder as auditorias quando necessário. Trabalhará como surpote nas nossas área de Manufatura e Qualidade e com outras areas envolvidas na criação de novos materiais dentro do nosso sistema.

Atividades

Ter contato direto com clientes internos, como parte do processo de solicitação de novos cadastros de materiais e prover serviço e suporte aos produtos e processos em suas áreas de atuação.
Utilizar base de dados interna e informações de fontes externas para conduzir e concretizar projetos.
Pro ativamente avaliar as necessidades das áreas de manufatura e qualidade em relação aos dados mestre e encontrar formas efetivas de satisfazê-las;
Cooperar diariamente com os demais membros do grupo;
Preparar apresentações (orais e escritas) de dados, metodologia, resultados e interpretação e documentos de trabalho escrevendo memorandos e relatórios adequados para a comunicação interna;
E realizar outras atividades da responsabilidade do cargo.

Requisistos

Superior completo , preferências para cursos de Gestão de Negocios, Administração e afins;
Inglês avançado (obrigatório) e Espanhol Intermediário (diferencial, não obrigatório);
Conhecimento Intermediário no Pacote Office ( principalmente Excel);
Conhecimento em Power BI (diferencial);
Ser um perfil analítico, comunicativo e que goste de trabalhar em grupo.

Outras informações

Local de trabalho: Unidade de Mauá - SP
Horário: 7:30 até as 17:20 ( Seg a sex)
Trabalho em modelo Híbrido (2x casa e 3x na empresa)

Na AkzoNobel, estamos altamente comprometidos em garantir um local de trabalho inclusivo e respeitoso, onde todos os funcionários possam ser o seu melhor eu. Nós nos esforçamos para abraçar a diversidade em um contexto de tolerância. Nosso processo de aquisição de talentos é parte integrante dessa jornada, pois estabelece as bases para um ambiente diversificado. Em nossa organização, todos os candidatos qualificados recebem consideração para o emprego, independentemente de raça, cor, religião, sexo, orientação sexual, identidade de gênero, origem nacional, idade ou deficiência.";https://careers.akzonobel.com/job/ANALISTA-CADASTRO-JR/942510701/;https://www.linkedin.com/jobs/view/3621326350/?alternateChannel=search&refId=tCWVCdLmkJlTrZ5vCMuj9w%3D%3D&trackingId=YV1u%2FEXgr0tsP6bmyY44HQ%3D%3D&trk=d_flagship3_search_srp_jobs;AkzoNobel;+ de 10.001 funcionários;Fabricação de produtos químicos
