position;company;location;posted_date;no_applicants;date_collected;type_workplace;required_skills;competitive_advantages;level;worktype;description;link_application;link_linkedin;company_name;company_size;company_sector
ANALISTA DE GESTÃO E GOVERNANÇA CORPORATIVA JUNIOR - CAMPINAS;{'name': 'Agibank', 'size': '1.001-5.000 funcionários', 'sector': 'Bancos'};Campinas, São Paulo, Brasil;2023-05-31 15:32:15.341356;124 candidaturas;2023-06-05 15:32:15.353525;;['Comunicação', 'Trabalho em equipe', 'Alinhamento de estratégia', 'Apresentações', 'Comunicação oral', 'Cooperação', 'Governança corporativa', 'Linhas de produção', 'Resolução de problemas', 'Treinamento'];;Pleno-sênior;Tempo integral;"Sobre a vaga
Empresa contratante: NEO

Múltiplas possibilidades em um só lugar. Vem pro Agi ;)

Aqui No Agi Você Terá Que
Apoiar no processo de definição de metas da empresa;
Atualizar mensalmente os indicadores da empresa e das áreas;
Montar painéis de indicadores;
Criar e gerenciar cursos, capacitações, treinamentos relacionados à estratégia, gestão de metas e governança;
Trabalhar em ações de comunicação para toda empresa sobre estratégia, governança e gestão de indicadores;
Implementar ações para garantir o alinhamento estratégico entre os colaboradores da empresa;
Gerenciar atas de reunião da Diretoria;
Apoiar nas atividades de Governança Corporativa do banco.
Mas, Antes De Tudo, Você Precisa Ter
Ensino superior completo ou em andamento em Administração, Economia, Engenharia ou áreas relacionadas
Excel intermediário
Habilidade para trabalhar em equipe
Boa comunicação oral e escrita para interlocução com áreas
Interesse por finanças
Visão crítica
Disponibilidade para modelo híbrido em Campinas
É um diferencial pra gente mas não é obrigatório, ok?
Conhecimento em SQL
Conhecimento em Power BI
Inglês Intermediário/Avançado
Curiosidade para procurar, aprender e testar novas tecnologias
Adaptar-se bem a novas situações e mudanças de prioridade
Valorizar a colaboração e a troca de experiências para fazer o time crescer
Incorporar responsabilidade da concepção até a entrega em produção
Gostar de disseminar conhecimento por meio de apresentações internas e externas
Vontade de crescer com a gente! \o/
Alguns benefícios pra você curtir a jornada com a gente ;)
Vale refeição e/ou alimentação
Plano de Saúde
Plano Odontológico
Folga de presente no seu aniversário
Programa de Participação nos Resutados (PPR) seguindo as regras e gatilhos estabelecidos anualmente para a esfera área e empresa
Tô de Dono/a, programa de sócios do Agi
Universidade Agi
Pesquisa semanal Sem Climão, pra ouvir você o tempo todo
Modelo de avaliação de performance 360
Conexão Saúde: teleatendimento psicológico e médico gratuito
Licença maternidade de 6 meses e licença paternidade de 20 dias
O Agi que acolhe

Nascemos há mais de 20 anos pra trazer soluções acessíveis para milhões brasileiros, especialmente os que mais precisam. Reunimos produtos financeiros e não financeiros, como crédito, conta corrente, seguros, investimentos e marketplace. Temos presença digital, por meio de 12 canais de atendimento, e quase 900 lojas físicas em todo o país.

O Agi de quem faz diferente

Quem é Agi entende a necessidade de cada cliente e a acolhe como se fosse sua, com atendimento humanizado e digitalização assistida. Fazer o dia a dia das pessoas melhor é estar sempre junto na hora que o cliente precisa, seja no físico ou digital.

O Agi de quem empreende

Somos uma empresa consolidada e temos alma de startup. Quem é Agi tem atitude pra contribuir ativamente em cada projeto e iniciativa. Aqui é lugar de gente que pega junto e que sabe que fazer a diferença no Agi, é também fazer a diferença no seu próprio desenvolvimento. Impulsionar a sua carreira está em suas mãos. A gente sempre vai te inspirar a trilhar uma jornada que faça sentido pra você e a construir os melhores caminhos.

O Agi de quem curte a jornada

Quem é Agi gosta de trabalhar em um ambiente em que possa ser quem é, respeitando as diferenças e dando espaço para todos. Se sente motivado em realizar os seus sonhos e tem atitude pra impulsionar quem está ao seu redor.

Quer construir em equipe, comemorar entregas e celebrar resultados?

Vem crescer com a gente :)

Pra conhecer as nossas avaliações no Glassdoor, clica aqui.

Pra acompanhar a gente no LinkedIn, clica aqui.";https://jobs.kenoby.com/agi/job/analista-de-gestao-e-governanca-corporativa-junior-campinas/646dd220d083d16dcd9f0d81?utm_source=website;https://www.linkedin.com/jobs/view/3623568363/?alternateChannel=search&refId=9aWZMpL%2Fuy1q3OVYErLUvQ%3D%3D&trackingId=ynqSD0OSBD6%2FD63QjeMjWA%3D%3D&trk=d_flagship3_search_srp_jobs;Agibank;1.001-5.000 funcionários;Bancos
Analista de Requisitos Júnior;{'name': 'Grupo MAG', 'size': '1.001-5.000 funcionários', 'sector': 'Serviços financeiros'};Rio de Janeiro, Brasil;2023-05-31 15:32:31.598734;;2023-06-05 15:32:31.603633;Híbrido;['SQL', 'Análise de negócios', 'Análise de requisitos', 'Azure DevOps', 'Gerenciamento de processos de negócios', 'Metodologias Agile', 'Microsoft Power BI', 'Requisitos funcionais', 'Scrum', 'UML (Linguagem de modelagem unificada)'];;Júnior;Tempo integral;"Sobre a vaga
O que esperamos de você:

Formação superior completa em Administração, Engenharia, Tecnologia da Informação ou áreas correlatas;
Experiência anterior com análise, coleta e documentação de requisitos e formulação de métricas de negócios para relatórios.
Proficiência em MS Office (Excel, PowerPoint, Word, Outlook).
Familiaridade com ferramentas de inteligência de negócios, linguagens de análise de dados (SQL e Python) e metodologias do ciclo de vida de desenvolvimento de software (Agile, Scrum, etc.);
Perfil analítico, resolutivo e com capacidade de gerenciar diversos projetos e tarefas simultaneamente;
Boa comunicação e relacionamento interpessoal;

Será um diferencial se você tiver:

Vivência anterior com Gestão de Processos de Negócios (BPM), incluindo mapeamento de processos, identificação de melhorias e implementação de mudanças;
Compreensão dos conceitos de engenharia de sistemas, além de técnicas e métodos de modelagem (BPM, UML. etc);
Conhecimento de ferramentas como Jira e Azure DevOps;

Quais serão seus desafios:

Realizar a análise, gerenciamento e comunicação de requisitos, buscando elucidar, traduzir e simplificar os mesmos;
Auxiliar no design ou modificação de sistemas;
Interagir com as partes interessadas do negócio e especialistas no assunto para entender seus problemas e necessidades;
Documentar e comunicar efetivamente suas percepções e planos para membros da equipe multifuncional e sua liderança;
Coletar informações críticas de reuniões com as diversas partes interessadas para posterior elaboração de relatórios;
Analisar, melhorar e desenvolver novos processos (BPM);

O que temos de bom:

Salário compatível com o mercado
Vale-refeição (sem desconto em folha e mantido durante as férias)
Vale-alimentação (sem desconto em folha e mantido durante as férias e valor dobrado no mês de Dezembro)
Vale-transporte
Plano de saúde (extensivo a dependentes)
Plano odontológico (extensivo a dependentes e aos pais)
Auxílio Creche/babá
Previdência Privada
Participação nos Lucros
Assistência funeral (extensivo a dependentes e aos pais)
Gympass
Auxílio Home Office
Seguro de vida
Atendimento médico e nutricional
Assistência financeira, jurídica e psicológica (extensivo a dependentes e aos pais)
Happy Day - uma folga no mês do aniversário + crédito extra no vale refeição
Café da Manhã
Universidade corporativa
Licença maternidade e paternidade estendidas

** Atuação em formato híbrido (de 4 a 8x/mês presencial no Centro do Rio de Janeiro) **";https://grupomag.gupy.io/jobs/4878055;https://www.linkedin.com/jobs/view/3620625628/?alternateChannel=search&refId=9aWZMpL%2Fuy1q3OVYErLUvQ%3D%3D&trackingId=P0oM7IMJN%2Ffezv7FZNt13w%3D%3D&trk=d_flagship3_search_srp_jobs;Grupo MAG;1.001-5.000 funcionários;Serviços financeiros
Analytics Data Process Analyst;{'name': 'Cargill', 'size': '+ de 10.001 funcionários', 'sector': 'Fabricação de alimentos e bebidas'};São Paulo, São Paulo, Brasil;2023-05-31 15:32:38.944240;101 candidaturas;2023-06-05 15:32:38.955420;;['Comunicação', 'Query Languages', 'Analítica de dados', 'Análise de dados nos negócios', 'Análise de negócios', 'Mapeamento de processos', 'Melhoria de processos', 'Relatórios e análises', 'Requisitos de negócio', 'Tomada de decisões baseadas em dados'];;Pleno-sênior;Tempo integral;"Sobre a vaga
Want to build a stronger, more sustainable future and cultivate your career? Join Cargill's global team of 160,000 employees who are committed to safe, responsible and sustainable ways to nourish the world. This position is in Cargill’s food ingredients and bio-industrial business, where we anticipate trends around taste, nutrition and safety to innovate and provide solutions to manufacturers, retailers and foodservice companies.

Job Purpose and Impact

The Analytics Data Process Analyst will develop an in depth understanding of the business to innovate significant data driven insights to help business leaders make better decisions and will develop and combine subject matter expertise in key data domains. Our aim is to empower the business to unlock value from data assets, uplift analytical capabilities and support data-driven decision making across the organization. In this role, you will act as a partner with internal stakeholders and technical staff to execute a business technology strategy that delivers reporting and analytics solutions. You will work closely with business teams to help explore how data and analytics solutions can address business needs. Together with business and technical stakeholders at the group, functional and regional level you will co-create and deliver data and analytics solutions.

Key Accountabilities
Identify and analyze business needs, gather requirements and define the scope and objectives to drive business decisions.
Prepare data and explore new potential data to support reporting and analysis initiatives.
Prepare reports and analysis to identify, analyze and interpret trends or patterns in complex data sets for values and new opportunities.
Lead analysis in collaboration with process and operations leadership to identify the top opportunities for improvement and track progress and impact on future results.
Mentor and coach peers and recommend process improvements related to delivery and new methodologies.
Partner with the team to develop a detailed understanding of the business and offer mentorship or technical solutions to identify business problems.
You will work under minimal supervision and independently handle complex issues while referring only the most complex issues to higher-level staff.
Help drive the adoption of new data and analytics solutions within our businesses and coach users to analyze and access data via various data and analytics tools.
Other duties as assigned

Qualifications

MINIMUM QUALIFICATIONS
Bachelor’s degree in a related field or equivalent experience
Minimum of four years of related work experience
Business acumen and the ability to partner and communicate effectively with business counterparts
Experience in translating business requirements into data solutions
Experience with data analytics tools and applications
Experience in extracting data from databases and other applications
Applied experience with data process mapping and business analysis
Fluent English is mandatory

Preferred Qualifications
Certification in programming language or business intelligence tools
Confirmed skills querying relational databases with query language
Confirmed experience working with large data stores
Experience with the Agile mindset

At Cargill, everyone matters and everyone counts. Cargill is committed to creating and sustaining an inclusive and diverse work environment where all employees are treated with dignity and respect. As such and in alignment with our Guiding Principles, Cargill's long-standing equal employment opportunity policy prohibits discrimination and harassment against any employee or applicant based on race, ethnicity, color, religion, national origin, ancestry, sex, gender, gender identity, gender expression, sexual orientation, age, disability, pregnancy, genetic information, marital status, family status, citizenship status, veteran status, military status, union affiliation, or any other status protected by law. Cargill also complies with all applicable national and local laws and regulations pertaining to non-discrimination and employment.";https://careers.cargill.com/en/job/-/-/23251/49432212064?utm_source=linkedin.com&utm_medium=job_posting&utm_campaign=Core_Media&utm_content=social_media&utm_term=361065804&ss=paid&dclid=CjgKEAjwj_ajBhCGvIab_9_lnlgSJADSd-Ap-W8YMKU7DxYRy6E9DrsswdFN45ntbNeF1RQum74Op_D_BwE;https://www.linkedin.com/jobs/view/3621016602/?alternateChannel=search&refId=9aWZMpL%2Fuy1q3OVYErLUvQ%3D%3D&trackingId=7bqSkLwrnl1XKsYom41LaQ%3D%3D&trk=d_flagship3_search_srp_jobs;Cargill;+ de 10.001 funcionários;Fabricação de alimentos e bebidas
SQL Developer;{'name': 'Turing', 'size': '1.001-5.000 funcionários', 'sector': 'Serviços e consultoria de TI'};Brasil;2023-06-03 15:32:52.712414;38 candidaturas;2023-06-05 15:32:52.722477;Remoto;['Banco de dados', 'Comunicação', 'SQL', 'Ciência da computação', 'ETL (Extração, transformação e carregamento)', 'Procedimentos armazenados', 'SQL Server Analysis Services (SSAS)', 'Serviços de Relatórios do SQL', 'Stored Procedures de T-SQL', 'Transact-SQL'];;Assistente;Tempo integral;"Sobre a vaga
A rapidly growing company with a customized compensation program tailored to its clients is looking for an SQL Developer. The selected candidate will be responsible for establishing the necessary links between the important facts. The company is suitable for any industry ranging from small to large companies. This is a nice opportunity for developers to work in an exceptional environment with several possibilities. This position requires an overlap with the EST time zone.

Job Responsibilities:

With the spreadsheet of the current customer, establish a database
Help build tailored solutions to fit the needs of customers
Review and analyze ongoing business requirements
Build useful and efficient reporting for deliverables

Job Requirements:

Bachelor’s/Master’s degree in Engineering, Computer Science (or equivalent experience)
At least 3+ years of relevant experience as a software engineer
Knowledge of SQL
Good English communication skills";https://www.turing.com/remote-developer-jobs/j/li-promoted/sql-developer-92646-br?country=Brazil&s=ads_developers_linkedinJobs&n=https://www.turing.com/remote-developer-jobs/j/li-promoted/sql-developer-92646-br?country=Brazil;https://www.linkedin.com/jobs/view/3624666046/?alternateChannel=search&refId=9aWZMpL%2Fuy1q3OVYErLUvQ%3D%3D&trackingId=sKHLqX0qbCGom0CmiEhVcA%3D%3D&trk=d_flagship3_search_srp_jobs;Turing;1.001-5.000 funcionários;Serviços e consultoria de TI
Analista de Planejamento Jr;{'name': 'CPFL Energia', 'size': '5.001-10.000 funcionários', 'sector': 'Serviços de eletricidade, gás, água e esgoto'};Jaguariúna, São Paulo, Brasil;2023-06-01 15:32:56.332159;;2023-06-05 15:32:56.338417;Presencial;['Contabilidade', 'Economia', 'Finanças', 'Habilidades analíticas', 'Inglês', 'Microsoft Office', 'Planejamento', 'Produtos SAP', 'Projeções', 'Relatório'];;;Tempo integral;"Sobre a vaga
A SUA ENERGIA FAZ A CPFL
Inovamos para oferecer as melhores soluções aos nossos clientes e trabalhamos de maneira colaborativa para entregar os melhores resultados e alcançar a excelência em tudo o que fazemos. Geramos valor de forma sustentável, atuando sempre com responsabilidade social, integridade, transparência e segurança. Para nós, o desenvolvimento de colaboradoras e colaboradores caminha junto com o crescimento da CPFL.

O Nosso Jeito de Ser valoriza a diversidade e respeita as diferenças, por isso praticamos ações afirmativas em que reservamos vagas para aumentar cada vez mais a representatividade de grupos sociais minorizados, como por exemplo, mulheres, pessoas com deficiência e pessoas negras. Essas ações fazem parte da nossa estratégia e compromissos para uma cultura inclusiva. Conheça mais sobre nosso posicionamento em link (https://cpfl.riweb.com.br/show.aspx?idCanal=m1DU2SlCXo7pvQ/fBEMIxg==)

Se você se identifica com os nossos valores e acredita que pode fazer a diferença para os nossos negócios, venha compartilhar a sua energia e crescer com a CPFL.

Onde você vai atuar: Jaguariúna,SP

Empresa: CPFL Total – Uma empresa do Grupo CPFL

Principais Atividades:
Apoiar na elaboração do processo orçamentário;
Elaborar e atualizar projeções de resultados.
Elaborar relatórios gerenciais e acompanhar indicadores.
Elaborar e atualizar normas internas e acompanhar sua efetividade.
Analisar variações de resultado (real vs. Orçado);
Apoio na elaboração de budget e forecast;

O que buscamos:
Ensino superior completo em: Administração, Ciências Contábeis ou Economia;
Conhecimento em pacote office no nível intermediário;
Experiência profissional na área financeira ou áreas correlatas com atividades de orçamento, custos, análise e planejamento financeiro;
Disponibilidade para atuação 100% presencial na cidade de Jaguariúna-SP
Desejável inglês intermediário;
Desejável experiência SAP.

O que oferecemos:
Vale Transporte;
Vale Refeição;
Assistência Médica;
Assistência Odontológica;
Licença maternidade 6 meses e paternidade 20 dias
Auxilio creche (conforme regras de elegibilidade);
Seguro de Vida;
PLR;
Gympass;
Programa Fale Comigo (assessoria gratuita e sigilosa via telefone para auxílio psicológico, jurídico, financeiro, social e fonoaudiólogo).
O Grupo CPFL Energia

A CPFL Energia, há 110 anos no setor elétrico, atua nos segmentos de distribuição, geração, transmissão, comercialização e serviços. Desde janeiro de 2017, o Grupo faz parte da State Grid, estatal chinesa que é a terceira maior organização empresarial do mundo e a maior empresa de energia elétrica, atendendo 88% do território chinês e com operações na Itália, Austrália, Portugal, Filipinas e Hong Kong.

Com 14% de participação, a CPFL Energia é uma das maiores empresas no mercado de distribuição, totalizando mais de 9,9 milhões de clientes em 687 cidades, entre os estados de São Paulo, Rio Grande do Sul, Minas Gerais e Paraná.

Na comercialização, é uma das líderes no mercado livre, com participação de mercado de 4%. É líder na comercialização de energia incentivada para clientes livres entre as comercializadoras.

Na geração, é a terceira maior agente privada do País, com capacidade instalada de 4.305 MW, no final de setembro de 2020. Tem um portfólio baseado em fontes limpas e renováveis, como grandes hidrelétricas, usinas eólicas, térmicas a biomassa, Pequenas Centrais Hidrelétricas (PCH) e usina solar. A CPFL Renováveis é a maior empresa de geração da América Latina a partir de fontes alternativas de energia.

A CPFL Energia possui ações listadas no Novo Mercado da B3. O Grupo também ocupa posição de destaque em arte e cultura, entre os maiores investidores brasileiros, por meio do Instituto CPFL.";https://career19.sapsf.com/sfcareer/jobreqcareer?jobId=28068&company=cpflenergi;https://www.linkedin.com/jobs/view/3621775643/?alternateChannel=search&refId=9aWZMpL%2Fuy1q3OVYErLUvQ%3D%3D&trackingId=JQyJrRAO4%2B7wFyAjAXdNSw%3D%3D&trk=d_flagship3_search_srp_jobs;CPFL Energia;5.001-10.000 funcionários;Serviços de eletricidade, gás, água e esgoto
Sports Statistician;{'name': 'Genius Sports', 'size': '1.001-5.000 funcionários', 'sector': 'Desenvolvimento de software'};Pato Branco, Paraná, Brasil;2023-05-29 15:33:24.748213;13 candidaturas;2023-06-05 15:33:24.759944;Presencial;['Contratação de pessoal', 'Esportes', 'Futsal', 'Inglês', 'Internet Access', 'Setor de esportes', 'Skype', 'Treinamento', 'Táticas', 'YouTube'];;Assistente;Contrato;"Sobre a vaga
Love sports?

We're looking for someone like you.

Job type - Contract based (Not part-time or full-time)

Get to know us - https://geniussports.com/statisticians-network/

This is an opportunity for exciting and fast-paced work as a Sports Statistician.

If you enjoy sports and would like to become a part of the sports industry, this could be your chance! You will get thorough training in using the company software which is used for entering the data in order to provide the best analyses of the game possible.

Requirements:
You are reliable, committed, organized, and honest
Above-average Football & Volleyball knowledge with regard to the Laws of the Game, basic tactics, and jargon
Regular availability on weekends and weekday evenings
Regular internet access
Access to Skype and YouTube for meetings and training tools

Interested and want to learn more?
Tell us a bit about yourself and we'll be in touch with you for more information about becoming sports a statistician. You must be 18 or older to apply.";https://boards.greenhouse.io/geniussports/jobs/4180598003?gh_jid=4180598003&gh_src=0d02f23f3us&s=LinkedIn&source=LinkedIn;https://www.linkedin.com/jobs/view/3619067815/?alternateChannel=search&refId=9aWZMpL%2Fuy1q3OVYErLUvQ%3D%3D&trackingId=KnS0kIihALZZZRWNVaA3vQ%3D%3D&trk=d_flagship3_search_srp_jobs;Genius Sports;1.001-5.000 funcionários;Desenvolvimento de software
Business Analyst - Payments Industry;{'name': 'Global Payments Inc.', 'size': '+ de 10.001 funcionários', 'sector': 'Serviços financeiros'};Campinas, São Paulo, Brasil;2023-06-02 15:33:29.394113;20 candidaturas;2023-06-05 15:33:29.404043;Híbrido;['Análise de negócios', 'Ciência da computação', 'Especificações de requisitos', 'Habilidades analíticas', 'Processos empresariais', 'Relacionamento com clientes', 'Requisitos de negócio', 'Resolução de problemas', 'Sistema de informação de gestão (MIS)', 'Teste de aceitação de usuários'];;Pleno-sênior;Tempo integral;"Sobre a vaga
Description

TSYS, a Global Payments company, is the payment stack for the future and operating in more than 75 countries around the world, we process billions of card transactions each year.

We are looking for Business Analysts to be part of our team in Brazil, so if you are pursuing professional development and would like to be part of our amazing growth in Latin America & The Caribbean, apply today and join our award-winning Fortune 500® company!

Wouldn’t you love being part of it?

If want more reasons for choosing us, we can help you:

Flexibility to work from home
People centered environment
Contact with teams from different countries
Attractive policy of salary and benefits

What Part Will You Play as a Business Analyst?

Develop working relationships with client, programmers and test analysts in order to ensure business requests to be solved with automated systems.
Assists with the identification, definition and documentation of business specifications.
Assists with coordinating documentation and client follow-up evaluation monitoring; post-implementation problems and revision requests. Maintains and administers procedures, methodology and/or application standards to include payment card industry and security related compliance.
Include analysis of business and user needs, documentation of requirements, and translation into proper system requirement specifications.

What Are We Looking For in This Role?

Bachelor's Degree in: Computer Science, Management Information Systems, Business or related field; or equivalent training or experience in lieu of degree;
Professional experience as Business Analyst, Product Owner or working with end-users to meet business needs;
Payments/Card industry experience;
Advanced English level.
Advanced Spanish level is a plus.

Fringe benefits (CLT Contract):

Bradesco Health Insurance - 100% paid by the company for employees and their dependents;
Bradesco Dental Insurance 100% paid by the company for employees and their dependents;
Daycare assistance;
Food /Meal voucher;
Life insurance;
Pension Plan.

At TSYS we recognize that innovation and transformation only happen in inclusive and safe work environment and as an equal opportunity employer, we strongly encourage people with disabilities to apply to any of our job positions.";https://jobs.globalpayments.com/en/jobs/r0042273/business-analyst-payments-industry/;https://www.linkedin.com/jobs/view/3624240456/?alternateChannel=search&refId=9aWZMpL%2Fuy1q3OVYErLUvQ%3D%3D&trackingId=hwUQU6deTi1v1rQLc7n%2FPw%3D%3D&trk=d_flagship3_search_srp_jobs;Global Payments Inc.;+ de 10.001 funcionários;Serviços financeiros
